throughput_benchmark/results/rowwise_int4_asym/matmul_benchmark.csv
kernel_name,layer,batch,in_features,out_features,copies,method,latency_ms,tflops,memory_mb,block_m,block_n,block_k,num_warps,num_stages
rowwise_int4_asym,q_proj,128,2048,2048,16,torch_fp16,0.016980,63.235081,8.000000,,,,,
rowwise_int4_asym,q_proj,128,2048,2048,16,torch_quantized_ref,0.166746,6.439377,2.011719,,,,,
rowwise_int4_asym,q_proj,128,2048,2048,16,triton_fixed,0.046029,23.327285,2.011719,32,32,32,,
rowwise_int4_asym,q_proj,128,2048,2048,16,triton_autotuned,0.062360,17.218438,2.011719,64,64,64,4,3
rowwise_int4_asym,q_proj,512,2048,2048,16,torch_fp16,0.031603,135.904296,8.000000,,,,,
rowwise_int4_asym,q_proj,512,2048,2048,16,torch_quantized_ref,0.161419,26.607537,2.011719,,,,,
rowwise_int4_asym,q_proj,512,2048,2048,16,triton_fixed,0.108715,39.506826,2.011719,32,32,32,,
rowwise_int4_asym,q_proj,512,2048,2048,16,triton_autotuned,0.062389,68.841606,2.011719,256,64,32,4,3
rowwise_int4_asym,q_proj,2048,2048,2048,16,torch_fp16,0.081428,210.982742,8.000000,,,,,
rowwise_int4_asym,q_proj,2048,2048,2048,16,torch_quantized_ref,0.227163,75.627979,2.011719,,,,,
rowwise_int4_asym,q_proj,2048,2048,2048,16,triton_fixed,0.441887,38.878417,2.011719,32,32,32,,
rowwise_int4_asym,q_proj,2048,2048,2048,16,triton_autotuned,0.178047,96.490792,2.011719,256,64,32,4,3
rowwise_int4_asym,k_proj,128,2048,512,16,torch_fp16,0.017590,15.260616,2.000000,,,,,
rowwise_int4_asym,k_proj,128,2048,512,16,torch_quantized_ref,0.146803,1.828548,0.502930,,,,,
rowwise_int4_asym,k_proj,128,2048,512,16,triton_fixed,0.041411,6.482295,0.502930,32,32,32,,
rowwise_int4_asym,k_proj,128,2048,512,16,triton_autotuned,0.061631,4.355501,0.502930,32,32,64,2,3
rowwise_int4_asym,k_proj,512,2048,512,16,torch_fp16,0.013696,78.398202,2.000000,,,,,
rowwise_int4_asym,k_proj,512,2048,512,16,torch_quantized_ref,0.136844,7.846439,0.502930,,,,,
rowwise_int4_asym,k_proj,512,2048,512,16,triton_fixed,0.041893,25.630310,0.502930,32,32,32,,
rowwise_int4_asym,k_proj,512,2048,512,16,triton_autotuned,0.061196,17.546085,0.502930,64,64,64,4,3
rowwise_int4_asym,k_proj,2048,2048,512,16,torch_fp16,0.031479,136.437563,2.000000,,,,,
rowwise_int4_asym,k_proj,2048,2048,512,16,torch_quantized_ref,0.137962,31.131471,0.502930,,,,,
rowwise_int4_asym,k_proj,2048,2048,512,16,triton_fixed,0.106926,40.167749,0.502930,32,32,32,,
rowwise_int4_asym,k_proj,2048,2048,512,16,triton_autotuned,0.061951,69.328412,0.502930,256,64,32,4,3
rowwise_int4_asym,v_proj,128,2048,512,16,torch_fp16,0.017880,15.013437,2.000000,,,,,
rowwise_int4_asym,v_proj,128,2048,512,16,torch_quantized_ref,0.146743,1.829285,0.502930,,,,,
rowwise_int4_asym,v_proj,128,2048,512,16,triton_fixed,0.041985,6.393659,0.502930,32,32,32,,
rowwise_int4_asym,v_proj,128,2048,512,16,triton_autotuned,0.060996,4.400835,0.502930,32,32,64,2,3
rowwise_int4_asym,v_proj,512,2048,512,16,torch_fp16,0.013643,78.705302,2.000000,,,,,
rowwise_int4_asym,v_proj,512,2048,512,16,torch_quantized_ref,0.136829,7.847320,0.502930,,,,,
rowwise_int4_asym,v_proj,512,2048,512,16,triton_fixed,0.041667,25.769474,0.502930,32,32,32,,
rowwise_int4_asym,v_proj,512,2048,512,16,triton_autotuned,0.060219,17.830555,0.502930,64,64,64,4,3
rowwise_int4_asym,v_proj,2048,2048,512,16,torch_fp16,0.031452,136.554173,2.000000,,,,,
rowwise_int4_asym,v_proj,2048,2048,512,16,torch_quantized_ref,0.137564,31.221702,0.502930,,,,,
rowwise_int4_asym,v_proj,2048,2048,512,16,triton_fixed,0.107491,39.956693,0.502930,32,32,32,,
rowwise_int4_asym,v_proj,2048,2048,512,16,triton_autotuned,0.064119,66.984608,0.502930,256,64,32,4,3
rowwise_int4_asym,o_proj,128,2048,2048,16,torch_fp16,0.014282,75.183583,8.000000,,,,,
rowwise_int4_asym,o_proj,128,2048,2048,16,torch_quantized_ref,0.146048,7.351963,2.011719,,,,,
rowwise_int4_asym,o_proj,128,2048,2048,16,triton_fixed,0.041182,26.072833,2.011719,32,32,32,,
rowwise_int4_asym,o_proj,128,2048,2048,16,triton_autotuned,0.060560,17.730121,2.011719,64,64,64,4,3
rowwise_int4_asym,o_proj,512,2048,2048,16,torch_fp16,0.032775,131.045125,8.000000,,,,,
rowwise_int4_asym,o_proj,512,2048,2048,16,torch_quantized_ref,0.163757,26.227616,2.011719,,,,,
rowwise_int4_asym,o_proj,512,2048,2048,16,triton_fixed,0.109281,39.302178,2.011719,32,32,32,,
rowwise_int4_asym,o_proj,512,2048,2048,16,triton_autotuned,0.066701,64.390922,2.011719,256,64,32,4,3
rowwise_int4_asym,o_proj,2048,2048,2048,16,torch_fp16,0.082826,207.420603,8.000000,,,,,
rowwise_int4_asym,o_proj,2048,2048,2048,16,torch_quantized_ref,0.231178,74.314489,2.011719,,,,,
rowwise_int4_asym,o_proj,2048,2048,2048,16,triton_fixed,0.439487,39.090703,2.011719,32,32,32,,
rowwise_int4_asym,o_proj,2048,2048,2048,16,triton_autotuned,0.205868,83.450829,2.011719,256,64,32,4,3
rowwise_int4_asym,gate_proj,128,2048,8192,16,torch_fp16,0.037946,113.187493,32.000000,,,,,
rowwise_int4_asym,gate_proj,128,2048,8192,16,torch_quantized_ref,0.558942,7.684105,8.046875,,,,,
rowwise_int4_asym,gate_proj,128,2048,8192,16,triton_fixed,0.115393,37.220358,8.046875,32,32,32,,
rowwise_int4_asym,gate_proj,128,2048,8192,16,triton_autotuned,0.073013,58.824339,8.046875,64,64,64,4,3
rowwise_int4_asym,gate_proj,512,2048,8192,16,torch_fp16,0.110118,156.013150,32.000000,,,,,
rowwise_int4_asym,gate_proj,512,2048,8192,16,torch_quantized_ref,0.642478,26.740007,8.046875,,,,,
rowwise_int4_asym,gate_proj,512,2048,8192,16,triton_fixed,0.431084,39.852674,8.046875,32,32,32,,
rowwise_int4_asym,gate_proj,512,2048,8192,16,triton_autotuned,0.177468,96.805711,8.046875,256,64,32,4,3
rowwise_int4_asym,gate_proj,2048,2048,8192,16,torch_fp16,0.351760,195.358802,32.000000,,,,,
rowwise_int4_asym,gate_proj,2048,2048,8192,16,torch_quantized_ref,0.879433,78.140697,8.046875,,,,,
rowwise_int4_asym,gate_proj,2048,2048,8192,16,triton_fixed,1.728629,39.753742,8.046875,32,32,32,,
rowwise_int4_asym,gate_proj,2048,2048,8192,16,triton_autotuned,0.532123,129.142120,8.046875,256,128,32,8,3
rowwise_int4_asym,up_proj,128,2048,8192,16,torch_fp16,0.038031,112.933209,32.000000,,,,,
rowwise_int4_asym,up_proj,128,2048,8192,16,torch_quantized_ref,0.562679,7.633068,8.046875,,,,,
rowwise_int4_asym,up_proj,128,2048,8192,16,triton_fixed,0.116245,36.947607,8.046875,32,32,32,,
rowwise_int4_asym,up_proj,128,2048,8192,16,triton_autotuned,0.079756,53.851446,8.046875,64,64,64,4,3
rowwise_int4_asym,up_proj,512,2048,8192,16,torch_fp16,0.112657,152.497190,32.000000,,,,,
rowwise_int4_asym,up_proj,512,2048,8192,16,torch_quantized_ref,0.649542,26.449189,8.046875,,,,,
rowwise_int4_asym,up_proj,512,2048,8192,16,triton_fixed,0.436491,39.359086,8.046875,32,32,32,,
rowwise_int4_asym,up_proj,512,2048,8192,16,triton_autotuned,0.198263,86.651761,8.046875,256,64,32,4,3
rowwise_int4_asym,up_proj,2048,2048,8192,16,torch_fp16,0.355742,193.172360,32.000000,,,,,
rowwise_int4_asym,up_proj,2048,2048,8192,16,torch_quantized_ref,0.893702,76.893047,8.046875,,,,,
rowwise_int4_asym,up_proj,2048,2048,8192,16,triton_fixed,1.728835,39.749005,8.046875,32,32,32,,
rowwise_int4_asym,up_proj,2048,2048,8192,16,triton_autotuned,0.542235,126.733853,8.046875,256,128,32,8,3
rowwise_int4_asym,down_proj,128,8192,2048,16,torch_fp16,0.041702,102.992470,32.000000,,,,,
rowwise_int4_asym,down_proj,128,8192,2048,16,torch_quantized_ref,0.557853,7.699101,8.011719,,,,,
rowwise_int4_asym,down_proj,128,8192,2048,16,triton_fixed,0.149092,28.807403,8.011719,32,32,32,,
rowwise_int4_asym,down_proj,128,8192,2048,16,triton_autotuned,0.113026,37.999843,8.011719,64,64,64,4,3
rowwise_int4_asym,down_proj,512,8192,2048,16,torch_fp16,0.104504,164.394364,32.000000,,,,,
rowwise_int4_asym,down_proj,512,8192,2048,16,torch_quantized_ref,0.636462,26.992761,8.011719,,,,,
rowwise_int4_asym,down_proj,512,8192,2048,16,triton_fixed,0.457082,37.585975,8.011719,32,32,32,,
rowwise_int4_asym,down_proj,512,8192,2048,16,triton_autotuned,0.232789,73.800242,8.011719,256,64,32,4,3
rowwise_int4_asym,down_proj,2048,8192,2048,16,torch_fp16,0.381563,180.100149,32.000000,,,,,
rowwise_int4_asym,down_proj,2048,8192,2048,16,torch_quantized_ref,0.907865,75.693472,8.011719,,,,,
rowwise_int4_asym,down_proj,2048,8192,2048,16,triton_fixed,1.911770,35.945481,8.011719,32,32,32,,
rowwise_int4_asym,down_proj,2048,8192,2048,16,triton_autotuned,0.748389,91.823152,8.011719,256,128,32,8,3
rowwise_int4_asym,lm_head,128,2048,128256,1,torch_fp16,0.424355,158.459540,501.000000,,,,,
rowwise_int4_asym,lm_head,128,2048,128256,1,torch_quantized_ref,7.897340,8.514649,125.983887,,,,,
rowwise_int4_asym,lm_head,128,2048,128256,1,triton_fixed,1.733837,38.782827,125.983887,32,32,32,,
rowwise_int4_asym,lm_head,128,2048,128256,1,triton_autotuned,0.775229,86.739658,125.983887,128,64,32,4,2
rowwise_int4_asym,lm_head,512,2048,128256,1,torch_fp16,1.787119,150.506136,501.000000,,,,,
rowwise_int4_asym,lm_head,512,2048,128256,1,torch_quantized_ref,8.872609,30.314907,125.983887,,,,,
rowwise_int4_asym,lm_head,512,2048,128256,1,triton_fixed,6.762349,39.774987,125.983887,32,32,32,,
rowwise_int4_asym,lm_head,512,2048,128256,1,triton_autotuned,2.085041,129.000956,125.983887,256,128,32,8,3
rowwise_int4_asym,lm_head,2048,2048,128256,1,torch_fp16,6.299752,170.782815,501.000000,,,,,
rowwise_int4_asym,lm_head,2048,2048,128256,1,torch_quantized_ref,12.904939,83.370352,125.983887,,,,,
rowwise_int4_asym,lm_head,2048,2048,128256,1,triton_fixed,27.012883,39.828747,125.983887,32,32,32,,
rowwise_int4_asym,lm_head,2048,2048,128256,1,triton_autotuned,8.203650,131.147638,125.983887,256,128,32,8,3
