throughput_benchmark/results/rowwise_int4_asym/matmul_benchmark_autotuned.csv
kernel_name,layer,batch,in_features,out_features,copies,method,latency_ms,tflops,memory_mb,block_m,block_n,block_k,num_warps,num_stages
rowwise_int4_asym,q_proj,128,2048,2048,16,torch_fp16,0.016923,63.450320,8.000000,,,,,
rowwise_int4_asym,q_proj,128,2048,2048,16,torch_quantized_ref,0.166700,6.441144,2.011719,,,,,
rowwise_int4_asym,q_proj,128,2048,2048,16,triton_fixed,0.074568,14.399437,2.011719,256,64,32,,
rowwise_int4_asym,q_proj,128,2048,2048,16,triton_autotuned,0.062317,17.230287,2.011719,64,64,64,4,3
rowwise_int4_asym,q_proj,512,2048,2048,16,torch_fp16,0.031647,135.714657,8.000000,,,,,
rowwise_int4_asym,q_proj,512,2048,2048,16,torch_quantized_ref,0.161168,26.649061,2.011719,,,,,
rowwise_int4_asym,q_proj,512,2048,2048,16,triton_fixed,0.062501,68.718596,2.011719,256,64,32,,
rowwise_int4_asym,q_proj,512,2048,2048,16,triton_autotuned,0.061902,69.382889,2.011719,256,64,32,4,3
rowwise_int4_asym,q_proj,2048,2048,2048,16,torch_fp16,0.081423,210.995172,8.000000,,,,,
rowwise_int4_asym,q_proj,2048,2048,2048,16,torch_quantized_ref,0.229848,74.744584,2.011719,,,,,
rowwise_int4_asym,q_proj,2048,2048,2048,16,triton_fixed,0.206353,83.254775,2.011719,256,64,32,,
rowwise_int4_asym,q_proj,2048,2048,2048,16,triton_autotuned,0.175062,98.136047,2.011719,256,64,32,4,3
rowwise_int4_asym,k_proj,128,2048,512,16,torch_fp16,0.017487,15.350256,2.000000,,,,,
rowwise_int4_asym,k_proj,128,2048,512,16,torch_quantized_ref,0.144467,1.858115,0.502930,,,,,
rowwise_int4_asym,k_proj,128,2048,512,16,triton_fixed,0.062235,4.313286,0.502930,256,64,32,,
rowwise_int4_asym,k_proj,128,2048,512,16,triton_autotuned,0.060876,4.409580,0.502930,32,32,64,2,3
rowwise_int4_asym,k_proj,512,2048,512,16,torch_fp16,0.013668,78.556052,2.000000,,,,,
rowwise_int4_asym,k_proj,512,2048,512,16,torch_quantized_ref,0.135145,7.945093,0.502930,,,,,
rowwise_int4_asym,k_proj,512,2048,512,16,triton_fixed,0.061527,17.451544,0.502930,256,64,32,,
rowwise_int4_asym,k_proj,512,2048,512,16,triton_autotuned,0.060973,17.609993,0.502930,64,64,64,4,3
rowwise_int4_asym,k_proj,2048,2048,512,16,torch_fp16,0.031494,136.372410,2.000000,,,,,
rowwise_int4_asym,k_proj,2048,2048,512,16,torch_quantized_ref,0.135569,31.680978,0.502930,,,,,
rowwise_int4_asym,k_proj,2048,2048,512,16,triton_fixed,0.061677,69.636678,0.502930,256,64,32,,
rowwise_int4_asym,k_proj,2048,2048,512,16,triton_autotuned,0.062106,69.155163,0.502930,256,64,32,4,3
rowwise_int4_asym,v_proj,128,2048,512,16,torch_fp16,0.017323,15.496006,2.000000,,,,,
rowwise_int4_asym,v_proj,128,2048,512,16,torch_quantized_ref,0.166948,1.607894,0.502930,,,,,
rowwise_int4_asym,v_proj,128,2048,512,16,triton_fixed,0.061772,4.345551,0.502930,256,64,32,,
rowwise_int4_asym,v_proj,128,2048,512,16,triton_autotuned,0.077840,3.448554,0.502930,32,32,64,2,3
rowwise_int4_asym,v_proj,512,2048,512,16,torch_fp16,0.013625,78.806970,2.000000,,,,,
rowwise_int4_asym,v_proj,512,2048,512,16,torch_quantized_ref,0.147688,7.270355,0.502930,,,,,
rowwise_int4_asym,v_proj,512,2048,512,16,triton_fixed,0.061518,17.453994,0.502930,256,64,32,,
rowwise_int4_asym,v_proj,512,2048,512,16,triton_autotuned,0.060030,17.886635,0.502930,64,64,64,4,3
rowwise_int4_asym,v_proj,2048,2048,512,16,torch_fp16,0.031506,136.321162,2.000000,,,,,
rowwise_int4_asym,v_proj,2048,2048,512,16,torch_quantized_ref,0.135565,31.682023,0.502930,,,,,
rowwise_int4_asym,v_proj,2048,2048,512,16,triton_fixed,0.061682,69.631257,0.502930,256,64,32,,
rowwise_int4_asym,v_proj,2048,2048,512,16,triton_autotuned,0.061788,69.510812,0.502930,256,64,32,4,3
rowwise_int4_asym,o_proj,128,2048,2048,16,torch_fp16,0.013747,78.109858,8.000000,,,,,
rowwise_int4_asym,o_proj,128,2048,2048,16,torch_quantized_ref,0.142305,7.545375,2.011719,,,,,
rowwise_int4_asym,o_proj,128,2048,2048,16,triton_fixed,0.061615,17.426528,2.011719,256,64,32,,
rowwise_int4_asym,o_proj,128,2048,2048,16,triton_autotuned,0.059726,17.977675,2.011719,64,64,64,4,3
rowwise_int4_asym,o_proj,512,2048,2048,16,torch_fp16,0.031591,135.955231,8.000000,,,,,
rowwise_int4_asym,o_proj,512,2048,2048,16,torch_quantized_ref,0.160892,26.694696,2.011719,,,,,
rowwise_int4_asym,o_proj,512,2048,2048,16,triton_fixed,0.063156,68.005515,2.011719,256,64,32,,
rowwise_int4_asym,o_proj,512,2048,2048,16,triton_autotuned,0.063303,67.847382,2.011719,256,64,32,4,3
rowwise_int4_asym,o_proj,2048,2048,2048,16,torch_fp16,0.081767,210.107500,8.000000,,,,,
rowwise_int4_asym,o_proj,2048,2048,2048,16,torch_quantized_ref,0.233951,73.433706,2.011719,,,,,
rowwise_int4_asym,o_proj,2048,2048,2048,16,triton_fixed,0.208715,82.312621,2.011719,256,64,32,,
rowwise_int4_asym,o_proj,2048,2048,2048,16,triton_autotuned,0.196590,87.389298,2.011719,256,64,32,4,3
rowwise_int4_asym,gate_proj,128,2048,8192,16,torch_fp16,0.036846,116.565109,32.000000,,,,,
rowwise_int4_asym,gate_proj,128,2048,8192,16,torch_quantized_ref,0.558546,7.689551,8.046875,,,,,
rowwise_int4_asym,gate_proj,128,2048,8192,16,triton_fixed,0.101890,42.153017,8.046875,256,64,32,,
rowwise_int4_asym,gate_proj,128,2048,8192,16,triton_autotuned,0.072996,58.838265,8.046875,64,64,64,4,3
rowwise_int4_asym,gate_proj,512,2048,8192,16,torch_fp16,0.109185,157.346946,32.000000,,,,,
rowwise_int4_asym,gate_proj,512,2048,8192,16,torch_quantized_ref,0.641107,26.797213,8.046875,,,,,
rowwise_int4_asym,gate_proj,512,2048,8192,16,triton_fixed,0.198194,86.682257,8.046875,256,64,32,,
rowwise_int4_asym,gate_proj,512,2048,8192,16,triton_autotuned,0.165652,103.710302,8.046875,256,64,32,4,3
rowwise_int4_asym,gate_proj,2048,2048,8192,16,torch_fp16,0.354482,193.858901,32.000000,,,,,
rowwise_int4_asym,gate_proj,2048,2048,8192,16,torch_quantized_ref,0.887108,77.464625,8.046875,,,,,
rowwise_int4_asym,gate_proj,2048,2048,8192,16,triton_fixed,0.567661,121.057290,8.046875,256,64,32,,
rowwise_int4_asym,gate_proj,2048,2048,8192,16,triton_autotuned,0.530995,129.416460,8.046875,256,128,32,8,3
rowwise_int4_asym,up_proj,128,2048,8192,16,torch_fp16,0.038159,112.554388,32.000000,,,,,
rowwise_int4_asym,up_proj,128,2048,8192,16,torch_quantized_ref,0.565156,7.599620,8.046875,,,,,
rowwise_int4_asym,up_proj,128,2048,8192,16,triton_fixed,0.103699,41.417556,8.046875,256,64,32,,
rowwise_int4_asym,up_proj,128,2048,8192,16,triton_autotuned,0.078735,54.549850,8.046875,64,64,64,4,3
rowwise_int4_asym,up_proj,512,2048,8192,16,torch_fp16,0.111692,153.814457,32.000000,,,,,
rowwise_int4_asym,up_proj,512,2048,8192,16,torch_quantized_ref,0.648821,26.478592,8.046875,,,,,
rowwise_int4_asym,up_proj,512,2048,8192,16,triton_fixed,0.196583,87.392571,8.046875,256,64,32,,
rowwise_int4_asym,up_proj,512,2048,8192,16,triton_autotuned,0.190594,90.138596,8.046875,256,64,32,4,3
rowwise_int4_asym,up_proj,2048,2048,8192,16,torch_fp16,0.341253,201.374113,32.000000,,,,,
rowwise_int4_asym,up_proj,2048,2048,8192,16,torch_quantized_ref,0.885399,77.614159,8.046875,,,,,
rowwise_int4_asym,up_proj,2048,2048,8192,16,triton_fixed,0.572718,119.988313,8.046875,256,64,32,,
rowwise_int4_asym,up_proj,2048,2048,8192,16,triton_autotuned,0.552701,124.333954,8.046875,256,128,32,8,3
rowwise_int4_asym,down_proj,128,8192,2048,16,torch_fp16,0.042165,101.861447,32.000000,,,,,
rowwise_int4_asym,down_proj,128,8192,2048,16,torch_quantized_ref,0.561804,7.644950,8.011719,,,,,
rowwise_int4_asym,down_proj,128,8192,2048,16,triton_fixed,0.242943,17.678907,8.011719,256,64,32,,
rowwise_int4_asym,down_proj,128,8192,2048,16,triton_autotuned,0.114686,37.449664,8.011719,64,64,64,4,3
rowwise_int4_asym,down_proj,512,8192,2048,16,torch_fp16,0.105257,163.218371,32.000000,,,,,
rowwise_int4_asym,down_proj,512,8192,2048,16,torch_quantized_ref,0.636292,26.999956,8.011719,,,,,
rowwise_int4_asym,down_proj,512,8192,2048,16,triton_fixed,0.256986,66.851484,8.011719,256,64,32,,
rowwise_int4_asym,down_proj,512,8192,2048,16,triton_autotuned,0.232791,73.799426,8.011719,256,64,32,4,3
rowwise_int4_asym,down_proj,2048,8192,2048,16,torch_fp16,0.374771,183.363817,32.000000,,,,,
rowwise_int4_asym,down_proj,2048,8192,2048,16,torch_quantized_ref,0.913105,75.259123,8.011719,,,,,
rowwise_int4_asym,down_proj,2048,8192,2048,16,triton_fixed,0.829203,82.874141,8.011719,256,64,32,,
rowwise_int4_asym,down_proj,2048,8192,2048,16,triton_autotuned,0.752183,91.360088,8.011719,256,128,32,8,3
rowwise_int4_asym,lm_head,128,2048,128256,1,torch_fp16,0.423325,158.844893,501.000000,,,,,
rowwise_int4_asym,lm_head,128,2048,128256,1,torch_quantized_ref,7.889598,8.523004,125.983887,,,,,
rowwise_int4_asym,lm_head,128,2048,128256,1,triton_fixed,1.012224,66.431031,125.983887,256,64,32,,
rowwise_int4_asym,lm_head,128,2048,128256,1,triton_autotuned,0.779082,86.310707,125.983887,128,64,32,4,2
rowwise_int4_asym,lm_head,512,2048,128256,1,torch_fp16,1.775817,151.463967,501.000000,,,,,
rowwise_int4_asym,lm_head,512,2048,128256,1,torch_quantized_ref,8.884450,30.274505,125.983887,,,,,
rowwise_int4_asym,lm_head,512,2048,128256,1,triton_fixed,2.168285,124.048398,125.983887,256,64,32,,
rowwise_int4_asym,lm_head,512,2048,128256,1,triton_autotuned,2.084138,129.056896,125.983887,256,128,32,8,3
rowwise_int4_asym,lm_head,2048,2048,128256,1,torch_fp16,6.306623,170.596739,501.000000,,,,,
rowwise_int4_asym,lm_head,2048,2048,128256,1,torch_quantized_ref,12.944113,83.118043,125.983887,,,,,
rowwise_int4_asym,lm_head,2048,2048,128256,1,triton_fixed,8.491298,126.704935,125.983887,256,64,32,,
rowwise_int4_asym,lm_head,2048,2048,128256,1,triton_autotuned,8.106773,132.714867,125.983887,256,128,32,8,3
