throughput_benchmark/results/rowwise_int4/matmul_benchmark_autotuned.csv
kernel_name,layer,batch,in_features,out_features,copies,method,latency_ms,tflops,memory_mb,block_m,block_n,block_k,num_warps,num_stages
rowwise_int4,q_proj,128,2048,2048,16,torch_fp16,0.016941,63.379607,8.000000,,,,,
rowwise_int4,q_proj,128,2048,2048,16,torch_quantized_ref,0.195210,5.500447,2.003906,,,,,
rowwise_int4,q_proj,128,2048,2048,16,triton_fixed,0.080685,13.307751,2.003906,256,64,32,,
rowwise_int4,q_proj,128,2048,2048,16,triton_autotuned,0.058375,18.393852,2.003906,64,64,64,4,3
rowwise_int4,q_proj,512,2048,2048,16,torch_fp16,0.031637,135.758585,8.000000,,,,,
rowwise_int4,q_proj,512,2048,2048,16,torch_quantized_ref,0.189345,22.683294,2.003906,,,,,
rowwise_int4,q_proj,512,2048,2048,16,triton_fixed,0.067251,63.864848,2.003906,256,64,32,,
rowwise_int4,q_proj,512,2048,2048,16,triton_autotuned,0.067367,63.754729,2.003906,256,64,32,4,3
rowwise_int4,q_proj,2048,2048,2048,16,torch_fp16,0.081279,211.369817,8.000000,,,,,
rowwise_int4,q_proj,2048,2048,2048,16,torch_quantized_ref,0.252314,68.089265,2.003906,,,,,
rowwise_int4,q_proj,2048,2048,2048,16,triton_fixed,0.181744,94.527846,2.003906,256,64,32,,
rowwise_int4,q_proj,2048,2048,2048,16,triton_autotuned,0.163525,105.059717,2.003906,256,64,32,4,3
rowwise_int4,k_proj,128,2048,512,16,torch_fp16,0.017749,15.123602,2.000000,,,,,
rowwise_int4,k_proj,128,2048,512,16,torch_quantized_ref,0.172574,1.555477,0.500977,,,,,
rowwise_int4,k_proj,128,2048,512,16,triton_fixed,0.067069,4.002370,0.500977,256,64,32,,
rowwise_int4,k_proj,128,2048,512,16,triton_autotuned,0.057297,4.684960,0.500977,32,64,64,4,3
rowwise_int4,k_proj,512,2048,512,16,torch_fp16,0.013721,78.255594,2.000000,,,,,
rowwise_int4,k_proj,512,2048,512,16,torch_quantized_ref,0.163289,6.575716,0.500977,,,,,
rowwise_int4,k_proj,512,2048,512,16,triton_fixed,0.066820,16.069207,0.500977,256,64,32,,
rowwise_int4,k_proj,512,2048,512,16,triton_autotuned,0.057697,18.610023,0.500977,64,64,64,4,3
rowwise_int4,k_proj,2048,2048,512,16,torch_fp16,0.031575,136.025512,2.000000,,,,,
rowwise_int4,k_proj,2048,2048,512,16,torch_quantized_ref,0.162140,26.489279,0.500977,,,,,
rowwise_int4,k_proj,2048,2048,512,16,triton_fixed,0.067213,63.901031,0.500977,256,64,32,,
rowwise_int4,k_proj,2048,2048,512,16,triton_autotuned,0.067356,63.764722,0.500977,256,64,32,4,3
rowwise_int4,v_proj,128,2048,512,16,torch_fp16,0.017492,15.346325,2.000000,,,,,
rowwise_int4,v_proj,128,2048,512,16,torch_quantized_ref,0.171261,1.567405,0.500977,,,,,
rowwise_int4,v_proj,128,2048,512,16,triton_fixed,0.066239,4.052546,0.500977,256,64,32,,
rowwise_int4,v_proj,128,2048,512,16,triton_autotuned,0.057856,4.639691,0.500977,32,64,64,4,3
rowwise_int4,v_proj,512,2048,512,16,torch_fp16,0.013722,78.251943,2.000000,,,,,
rowwise_int4,v_proj,512,2048,512,16,torch_quantized_ref,0.161588,6.644955,0.500977,,,,,
rowwise_int4,v_proj,512,2048,512,16,triton_fixed,0.066820,16.069207,0.500977,256,64,32,,
rowwise_int4,v_proj,512,2048,512,16,triton_autotuned,0.056387,19.042513,0.500977,64,64,64,4,3
rowwise_int4,v_proj,2048,2048,512,16,torch_fp16,0.031564,136.069641,2.000000,,,,,
rowwise_int4,v_proj,2048,2048,512,16,torch_quantized_ref,0.162373,26.451273,0.500977,,,,,
rowwise_int4,v_proj,2048,2048,512,16,triton_fixed,0.067244,63.871840,0.500977,256,64,32,,
rowwise_int4,v_proj,2048,2048,512,16,triton_autotuned,0.067375,63.746855,0.500977,256,64,32,4,3
rowwise_int4,o_proj,128,2048,2048,16,torch_fp16,0.013779,77.924829,8.000000,,,,,
rowwise_int4,o_proj,128,2048,2048,16,torch_quantized_ref,0.171110,6.275164,2.003906,,,,,
rowwise_int4,o_proj,128,2048,2048,16,triton_fixed,0.066521,16.141407,2.003906,256,64,32,,
rowwise_int4,o_proj,128,2048,2048,16,triton_autotuned,0.056414,19.033224,2.003906,64,64,64,4,3
rowwise_int4,o_proj,512,2048,2048,16,torch_fp16,0.031592,135.951107,8.000000,,,,,
rowwise_int4,o_proj,512,2048,2048,16,torch_quantized_ref,0.189156,22.706011,2.003906,,,,,
rowwise_int4,o_proj,512,2048,2048,16,triton_fixed,0.067959,63.199053,2.003906,256,64,32,,
rowwise_int4,o_proj,512,2048,2048,16,triton_autotuned,0.068062,63.103376,2.003906,256,64,32,4,3
rowwise_int4,o_proj,2048,2048,2048,16,torch_fp16,0.081350,211.185237,8.000000,,,,,
rowwise_int4,o_proj,2048,2048,2048,16,torch_quantized_ref,0.260021,66.071132,2.003906,,,,,
rowwise_int4,o_proj,2048,2048,2048,16,triton_fixed,0.184831,92.949207,2.003906,256,64,32,,
rowwise_int4,o_proj,2048,2048,2048,16,triton_autotuned,0.177720,96.668351,2.003906,256,64,32,4,3
rowwise_int4,gate_proj,128,2048,8192,16,torch_fp16,0.035898,119.642839,32.000000,,,,,
rowwise_int4,gate_proj,128,2048,8192,16,torch_quantized_ref,0.721458,5.953178,8.015625,,,,,
rowwise_int4,gate_proj,128,2048,8192,16,triton_fixed,0.105280,40.795784,8.015625,256,64,32,,
rowwise_int4,gate_proj,128,2048,8192,16,triton_autotuned,0.063102,68.063801,8.015625,128,32,32,4,2
rowwise_int4,gate_proj,512,2048,8192,16,torch_fp16,0.108786,157.923183,32.000000,,,,,
rowwise_int4,gate_proj,512,2048,8192,16,torch_quantized_ref,0.799946,21.476289,8.015625,,,,,
rowwise_int4,gate_proj,512,2048,8192,16,triton_fixed,0.174802,98.281924,8.015625,256,64,32,,
rowwise_int4,gate_proj,512,2048,8192,16,triton_autotuned,0.162015,106.038520,8.015625,256,64,32,4,3
rowwise_int4,gate_proj,2048,2048,8192,16,torch_fp16,0.354725,193.725999,32.000000,,,,,
rowwise_int4,gate_proj,2048,2048,8192,16,torch_quantized_ref,1.029931,66.722377,8.015625,,,,,
rowwise_int4,gate_proj,2048,2048,8192,16,triton_fixed,0.567136,121.169373,8.015625,256,64,32,,
rowwise_int4,gate_proj,2048,2048,8192,16,triton_autotuned,0.566448,121.316409,8.015625,256,64,32,4,3
rowwise_int4,up_proj,128,2048,8192,16,torch_fp16,0.039510,108.704727,32.000000,,,,,
rowwise_int4,up_proj,128,2048,8192,16,torch_quantized_ref,0.728644,5.894467,8.015625,,,,,
rowwise_int4,up_proj,128,2048,8192,16,triton_fixed,0.107775,39.851105,8.015625,256,64,32,,
rowwise_int4,up_proj,128,2048,8192,16,triton_autotuned,0.066084,64.992386,8.015625,128,32,32,4,2
rowwise_int4,up_proj,512,2048,8192,16,torch_fp16,0.112505,152.703644,32.000000,,,,,
rowwise_int4,up_proj,512,2048,8192,16,torch_quantized_ref,0.803077,21.392543,8.015625,,,,,
rowwise_int4,up_proj,512,2048,8192,16,triton_fixed,0.177284,96.906008,8.015625,256,64,32,,
rowwise_int4,up_proj,512,2048,8192,16,triton_autotuned,0.175532,97.873052,8.015625,256,64,32,4,3
rowwise_int4,up_proj,2048,2048,8192,16,torch_fp16,0.352320,195.048288,32.000000,,,,,
rowwise_int4,up_proj,2048,2048,8192,16,torch_quantized_ref,1.029333,66.761164,8.015625,,,,,
rowwise_int4,up_proj,2048,2048,8192,16,triton_fixed,0.567165,121.163016,8.015625,256,64,32,,
rowwise_int4,up_proj,2048,2048,8192,16,triton_autotuned,0.571190,120.309226,8.015625,256,64,32,4,3
rowwise_int4,down_proj,128,8192,2048,16,torch_fp16,0.042344,101.429591,32.000000,,,,,
rowwise_int4,down_proj,128,8192,2048,16,torch_quantized_ref,0.728101,5.898866,8.003906,,,,,
rowwise_int4,down_proj,128,8192,2048,16,triton_fixed,0.263823,16.279747,8.003906,256,64,32,,
rowwise_int4,down_proj,128,8192,2048,16,triton_autotuned,0.132221,32.483138,8.003906,64,64,64,4,3
rowwise_int4,down_proj,512,8192,2048,16,torch_fp16,0.103879,165.383401,32.000000,,,,,
rowwise_int4,down_proj,512,8192,2048,16,torch_quantized_ref,0.793758,21.643717,8.003906,,,,,
rowwise_int4,down_proj,512,8192,2048,16,triton_fixed,0.267129,64.313016,8.003906,256,64,32,,
rowwise_int4,down_proj,512,8192,2048,16,triton_autotuned,0.253916,67.659611,8.003906,256,64,32,4,3
rowwise_int4,down_proj,2048,8192,2048,16,torch_fp16,0.368690,186.388426,32.000000,,,,,
rowwise_int4,down_proj,2048,8192,2048,16,torch_quantized_ref,1.056067,65.071121,8.003906,,,,,
rowwise_int4,down_proj,2048,8192,2048,16,triton_fixed,0.703303,97.709674,8.003906,256,64,32,,
rowwise_int4,down_proj,2048,8192,2048,16,triton_autotuned,0.688951,99.745125,8.003906,256,64,32,4,3
rowwise_int4,lm_head,128,2048,128256,1,torch_fp16,0.443832,151.505599,501.000000,,,,,
rowwise_int4,lm_head,128,2048,128256,1,torch_quantized_ref,10.249312,6.560741,125.494629,,,,,
rowwise_int4,lm_head,128,2048,128256,1,triton_fixed,1.017135,66.110257,125.494629,256,64,32,,
rowwise_int4,lm_head,128,2048,128256,1,triton_autotuned,0.789242,85.199547,125.494629,128,64,32,4,2
rowwise_int4,lm_head,512,2048,128256,1,torch_fp16,1.781675,150.965966,501.000000,,,,,
rowwise_int4,lm_head,512,2048,128256,1,torch_quantized_ref,11.120138,24.187859,125.494629,,,,,
rowwise_int4,lm_head,512,2048,128256,1,triton_fixed,2.193130,122.643153,125.494629,256,64,32,,
rowwise_int4,lm_head,512,2048,128256,1,triton_autotuned,2.201462,122.178950,125.494629,256,64,32,4,3
rowwise_int4,lm_head,2048,2048,128256,1,torch_fp16,6.306340,170.604384,501.000000,,,,,
rowwise_int4,lm_head,2048,2048,128256,1,torch_quantized_ref,15.012041,71.668423,125.494629,,,,,
rowwise_int4,lm_head,2048,2048,128256,1,triton_fixed,8.563541,125.636028,125.494629,256,64,32,,
rowwise_int4,lm_head,2048,2048,128256,1,triton_autotuned,8.558132,125.715433,125.494629,256,64,32,4,3
